{
  "$schema": "./schemas/standards-manifest.schema.json",
  "schemaVersion": 4,
  "version": "1.19.0",
  "name": "engineering-standards",
  "agentsEntry": "AGENTS.md",
  "defaultProfile": "dotnet-react",
  "paths": {
    "docs": "docs",
    "template": "templates",
    "extension": "docs/ext",
    "uiPatternLibrary": "patterns/ui"
  },
  "provisionRegistry": {
    "areas": [
      "BACKEND",
      "BLAZOR",
      "CORE",
      "EXT",
      "FRONTEND",
      "PROFILE",
      "QUALITY",
      "SVELTE",
      "WORKSPACE"
    ]
  },
  "profiles": {
    "dotnet-react": {
      "entry": "docs/profile/react.md",
      "pages": [
        "docs/workspace/structure.md",
        "docs/workspace/naming.md",
        "docs/workspace/dependencies.md",
        "docs/workspace/config.md",
        "docs/core/authoring.md",
        "docs/backend/architecture.md",
        "docs/backend/domain.md",
        "docs/backend/application.md",
        "docs/backend/persistence.md",
        "docs/backend/api.md",
        "docs/backend/testing.md",
        "docs/backend/identifiers.md",
        "docs/frontend/structure.md",
        "docs/frontend/rendering.md",
        "docs/frontend/components.md",
        "docs/frontend/ui.md",
        "docs/frontend/data.md",
        "docs/frontend/testing.md",
        "docs/quality/security.md",
        "docs/quality/operations.md",
        "docs/quality/ci.md"
      ]
    },
    "dotnet-blazor": {
      "entry": "docs/profile/blazor.md",
      "pages": [
        "docs/workspace/structure.md",
        "docs/workspace/naming.md",
        "docs/workspace/dependencies.md",
        "docs/workspace/config.md",
        "docs/core/authoring.md",
        "docs/backend/architecture.md",
        "docs/backend/domain.md",
        "docs/backend/application.md",
        "docs/backend/identifiers.md",
        "docs/blazor/structure.md",
        "docs/blazor/rendering.md",
        "docs/blazor/components.md",
        "docs/blazor/data.md",
        "docs/blazor/browser.md",
        "docs/blazor/testing.md",
        "docs/quality/security.md",
        "docs/quality/operations.md",
        "docs/quality/ci.md"
      ]
    },
    "dotnet-svelte": {
      "entry": "docs/profile/svelte.md",
      "pages": [
        "docs/workspace/structure.md",
        "docs/workspace/naming.md",
        "docs/workspace/dependencies.md",
        "docs/workspace/config.md",
        "docs/core/authoring.md",
        "docs/backend/architecture.md",
        "docs/backend/domain.md",
        "docs/backend/application.md",
        "docs/backend/persistence.md",
        "docs/backend/api.md",
        "docs/backend/testing.md",
        "docs/backend/identifiers.md",
        "docs/svelte/structure.md",
        "docs/svelte/rendering.md",
        "docs/svelte/components.md",
        "docs/svelte/ui.md",
        "docs/svelte/data.md",
        "docs/svelte/testing.md",
        "docs/quality/security.md",
        "docs/quality/operations.md",
        "docs/quality/ci.md"
      ]
    }
  },
  "extensions": {
    "bdd": {
      "path": "docs/ext/bdd.md",
      "activationScope": "local",
      "applicableKinds": [
        "use-case",
        "end-to-end-flow"
      ]
    },
    "compat": {
      "path": "docs/ext/compat.md",
      "activationScope": "project"
    },
    "cache": {
      "path": "docs/ext/cache.md",
      "activationScope": "local",
      "applicableKinds": [
        "use-case"
      ]
    },
    "concurrency": {
      "path": "docs/ext/concurrency.md",
      "activationScope": "local",
      "applicableKinds": [
        "module",
        "aggregate",
        "use-case",
        "workflow"
      ]
    },
    "lifecycle": {
      "path": "docs/ext/lifecycle.md",
      "activationScope": "local",
      "applicableKinds": [
        "use-case",
        "workflow",
        "domain-policy"
      ]
    },
    "containers": {
      "path": "docs/ext/containers.md",
      "activationScope": "project"
    },
    "integrations": {
      "path": "docs/ext/integrations.md",
      "activationScope": "local",
      "applicableKinds": [
        "use-case",
        "workflow",
        "domain-policy",
        "end-to-end-flow"
      ]
    },
    "audit": {
      "path": "docs/ext/audit.md",
      "activationScope": "project"
    },
    "locale": {
      "path": "docs/ext/locale.md",
      "activationScope": "project"
    },
    "mcp": {
      "path": "docs/ext/mcp.md",
      "activationScope": "project"
    },
    "tenancy": {
      "path": "docs/ext/tenancy.md",
      "activationScope": "project"
    },
    "outbox": {
      "path": "docs/ext/outbox.md",
      "activationScope": "local",
      "applicableKinds": [
        "use-case",
        "workflow",
        "end-to-end-flow"
      ]
    },
    "efcore": {
      "path": "docs/ext/efcore.md",
      "activationScope": "local",
      "applicableKinds": [
        "module",
        "use-case"
      ]
    },
    "realtime": {
      "path": "docs/ext/realtime.md",
      "activationScope": "local",
      "applicableKinds": [
        "use-case",
        "end-to-end-flow"
      ]
    },
    "report": {
      "path": "docs/ext/report.md",
      "activationScope": "local",
      "applicableKinds": [
        "use-case"
      ]
    },
    "jobs": {
      "path": "docs/ext/jobs.md",
      "activationScope": "local",
      "applicableKinds": [
        "use-case",
        "workflow",
        "end-to-end-flow"
      ]
    },
    "site": {
      "path": "docs/ext/site.md",
      "activationScope": "project"
    }
  },
  "stack": {
    "dotnet": "10.0.113",
    "aspnetcore": "10.0.13",
    "marten": "9.50.1",
    "postgresql": "18",
    "litebus": "7.0.0-preview.5",
    "aspire": "13.6.1",
    "node": "24.16.0",
    "pnpm": "11.13.1",
    "vite": "8.3.2",
    "react": "19.3.0",
    "svelte": "5.57.2",
    "sveltekit": "3.0.1",
    "bits-ui": "2.19.5",
    "typescript": "6.0.3",
    "tailwindcss": "4.3.3",
    "shadcn": "4.21.1",
    "base-ui": "1.8.0",
    "astro": "7.3.8",
    "@astrojs/svelte": "9.0.1"
  },
  "packages": {
    "nuget": {
      "Aspire.Hosting.AppHost": "13.6.1",
      "Aspire.Hosting.JavaScript": "13.6.1",
      "Aspire.Hosting.PostgreSQL": "13.6.1",
      "AwesomeAssertions": "9.6.0",
      "EFCore.NamingConventions": "10.0.1",
      "LiteBus.Analyzers": "7.0.0-preview.5",
      "LiteBus.Commands": "7.0.0-preview.5",
      "LiteBus.Commands.Abstractions": "7.0.0-preview.5",
      "LiteBus.Commands.Recurring": "7.0.0-preview.5",
      "LiteBus.Events": "7.0.0-preview.5",
      "LiteBus.Events.Abstractions": "7.0.0-preview.5",
      "LiteBus.Extensions.Microsoft.DependencyInjection": "7.0.0-preview.5",
      "LiteBus.Messaging": "7.0.0-preview.5",
      "LiteBus.Messaging.Abstractions": "7.0.0-preview.5",
      "LiteBus.Outbox": "7.0.0-preview.5",
      "LiteBus.Outbox.Abstractions": "7.0.0-preview.5",
      "LiteBus.Outbox.Dispatch.InProcess": "7.0.0-preview.5",
      "LiteBus.Outbox.Storage.PostgreSql": "7.0.0-preview.5",
      "LiteBus.Queries": "7.0.0-preview.5",
      "LiteBus.Queries.Abstractions": "7.0.0-preview.5",
      "LiteBus.Storage.PostgreSql": "7.0.0-preview.5",
      "LiteBus.Testing.Mediation": "7.0.0-preview.5",
      "Marten": "9.50.1",
      "Microsoft.AspNetCore.Authentication.JwtBearer": "10.0.13",
      "Microsoft.AspNetCore.DataProtection": "10.0.13",
      "Microsoft.AspNetCore.Mvc.Testing": "10.0.13",
      "Microsoft.AspNetCore.OpenApi": "10.0.13",
      "Microsoft.EntityFrameworkCore": "10.0.13",
      "Microsoft.Extensions.ApiDescription.Server": "10.0.13",
      "Microsoft.Extensions.Configuration.Abstractions": "10.0.13",
      "Microsoft.Extensions.DependencyInjection.Abstractions": "10.0.13",
      "Microsoft.Extensions.Diagnostics.HealthChecks": "10.0.13",
      "Microsoft.Extensions.Diagnostics.HealthChecks.Abstractions": "10.0.13",
      "Microsoft.Extensions.Hosting.Abstractions": "10.0.13",
      "Microsoft.Extensions.Http": "10.0.13",
      "Microsoft.Extensions.Http.Resilience": "10.11.0",
      "Microsoft.Extensions.Logging.Abstractions": "10.0.13",
      "Microsoft.Extensions.ServiceDiscovery": "10.11.0",
      "Microsoft.NET.Test.Sdk": "18.11.0",
      "Microsoft.OpenApi": "2.12.2",
      "Microsoft.Testing.Extensions.CodeCoverage": "18.12.0",
      "Microsoft.Testing.Extensions.TrxReport": "2.5.1",
      "NSubstitute": "6.2.0",
      "NetArchTest.Rules": "1.3.2",
      "Npgsql": "10.0.3",
      "Npgsql.EntityFrameworkCore.PostgreSQL": "10.0.3",
      "OpenTelemetry.Exporter.OpenTelemetryProtocol": "1.19.1",
      "OpenTelemetry.Extensions.Hosting": "1.19.1",
      "OpenTelemetry.Instrumentation.AspNetCore": "1.19.0",
      "OpenTelemetry.Instrumentation.Http": "1.19.0",
      "OpenTelemetry.Instrumentation.Runtime": "1.19.0",
      "Reqnroll": "3.3.4",
      "Reqnroll.xunit.v3": "3.3.4",
      "Scalar.AspNetCore": "2.18.0",
      "Testcontainers.PostgreSql": "4.16.0",
      "WireMock.Net": "2.19.0",
      "xunit.runner.visualstudio": "4.0.1",
      "xunit.v3": "4.0.2"
    },
    "npm": {
      "@axe-core/playwright": "4.13.0",
      "@base-ui/react": "1.8.0",
      "@eslint/js": "10.0.1",
      "@fontsource-variable/geist": "5.3.0",
      "@fontsource-variable/inter": "5.3.0",
      "@fontsource-variable/source-serif-4": "5.3.0",
      "@hey-api/openapi-ts": "0.99.0",
      "@modelcontextprotocol/server": "2.0.0",
      "@playwright/test": "1.63.0",
      "@preact/preset-vite": "2.10.6",
      "@sveltejs/adapter-node": "6.0.0",
      "@sveltejs/adapter-static": "4.0.0",
      "@sveltejs/kit": "3.0.1",
      "@sveltejs/vite-plugin-svelte": "7.3.1",
      "@tailwindcss/cli": "4.3.3",
      "@tailwindcss/vite": "4.3.3",
      "@tanstack/eslint-plugin-query": "5.104.1",
      "@tanstack/eslint-plugin-router": "1.162.0",
      "@tanstack/react-form": "1.33.5",
      "@tanstack/react-query": "5.104.1",
      "@tanstack/react-query-devtools": "5.104.1",
      "@tanstack/react-router": "1.170.41",
      "@tanstack/react-router-devtools": "1.167.2",